id	name	ash_of_war	affinity	can_be_applied_to	compatible_affinities	is_chargeable	basic_fp_cost	complex_fp_cost	FP	weapon	Effect
43	Vacuum Slice	TRUE	Quality	Daggers, Straight Swords, Greatswords, Colossal Swords, Curved Swords, Curved Greatswords, Katanas, Twinblades, Thrusting Swords, Heavy Thrusting Swords, Axes, Greataxes	Blood, Cold, Fire, Flame Art, Heavy, Keen, Lightning, Magic, None, Occult, Poison, Quality, Sacred, Standard		18		18		Lost skill of ancient heroes. Hold the armament aloft to surround it with a shearin vacuum, then launch it forwards as a blade-like projectile.
103	Viper Bite	FALSE					8		8	Coil Shield	Give the shield a quick shake to temporarily bring the bronze viper to life, inciting it to lash out and bite foes.
90	Vow of the Indomitable	TRUE	Sacred	Small Shields, Medium Shields, Greatshields	Standard, Heavy, Keen, Quality, Lightning, Sacred		20		20		Skill of the ancient warriors of the Erdtree. Hold shield aloft to imbue yourself with golden power, granting momentary invincibility.
85	War Cry	TRUE	Heavy	Straight Swords, Greatswords, Colossal Swords, Curved Swords, Curved Greatswords, Katanas, Twinblades, Hammers, Great Hammers, Axes, Greataxes, Flails, Spears, Great Spears, Halberds, Reapers, Fists, Claws, Colossal Weapons	Blood, Cold, Fire, Flame Art, Heavy, Keen, Lightning, Magic, None, Occult, Poison, Quality, Sacred, Standard		16		16		Give a war cry to rally the spirit and increase attack power.While active, strong attacks change to charging attacks.
123	Waterfowl Dance	FALSE				FALSE	12		12	Hand of Malenia	Perform a series of one-footed leaps in the manner of a waterfowl to unleash a swift yet graceful slashing combo. Repeated inputs allow for up to two follow-up attacks.
128	Wave of Destruction	FALSE					25		25	Ruins Greatsword	Raise the sword up high, then strike it against the ground to fire off a wave of gravitational force.
115	Wave of Gold	FALSE					50		50	Sacred Relic Sword	Imbue the sword with bygone golden glory, then fire it at foes. A wide, golden wave fans out forwards, sweeping through all enemies caught in its path.
74	Waves of Darkness	TRUE	Magic	Colossal Swords, Great Hammers, Greataxes, Colossal Weapons	Standard, Heavy, Keen, Quality, Magic, Cold		16		16		Plunge armament into the ground to release three waves of darkness. Follow up with a strong attack to swing the armament in a sweeping strike.
95	White Shadow's Lure	TRUE	Occult	Daggers, Straight Swords, Greatswords, Colossal Swords, Curved Swords, Curved Greatswords, Katanas, Twinblades, Thrusting Swords, Heavy Thrusting Swords, Hammers, Great Hammers, Axes, Greataxes, Flails, Spears, Great Spears, Halberds, Reapers, Fists, Claws, Whips, Colossal Weapons	Standard, Heavy, Keen, Quality, Poison, Blood, Occult		15		15		Hold armament in a brief, silent prayer to create a white shadow. The apparition lures in foes of human build who are not in combat, drawing their aggression. Effective on demi-humans even if they are already in a combat state.
11	Wild Strikes	TRUE	Heavy	Greatswords, Curved Swords, Curved Greatswords, Hammers, Great Hammers, Axes, Greataxes, Flails	Blood, Cold, Fire, Flame Art, Heavy, Keen, Lightning, Magic, None, Occult, Poison, Quality, Sacred, Standard		2	TRUE	2 (6 10)		Swing armament with wild abandon. Hold to continue swinging. Can be followed up with a normal or strong attack.
120	Wolf's Assault	FALSE					20		20	Royal Greatsword	Infuse the greatsword with frost, then perform a forward somersault to plunge it into the ground. Then, pull it out to release a cold blast.
151	Zamor Ice Storm	FALSE				FALSE	15		15	Zamor Curved Sword	Plunge the curved sword into the ground, building power before unleashing a freezing storm that batters the surroundings.